{
  "slot": "2026-06-28-13",
  "week": "2026-W26",
  "scored_at": "2026-06-28T13:37:15.465Z",
  "rubric_version": "1.0.0",
  "candidates": [
    {
      "id": "email-tone-dna",
      "name": "Email Tone DNA",
      "pitch": "Analyzes reply patterns from email threads to suggest tonality adjustments. Novel angle on personalization beyond just inserting name/company. Tip jar model works well for solo sellers.",
      "pain": "Cold emails feel generic when not tailored to a prospect's communication style and reply patterns.",
      "source_refs": [
        {
          "source": "ai_generated",
          "source_id": "ai-email-tone-dna-7xeeth",
          "url": "https://example.invalid/ai-idea/email-tone-dna"
        }
      ],
      "scores": {
        "demand": 5,
        "wtp": 8,
        "buildability": 5,
        "defensibility": 9
      },
      "score_total": 6.65,
      "monetization_hint": {
        "model": "Per-seat subscription",
        "tier": "per_seat",
        "monthly_price_usd": 20
      },
      "dedup_state": {
        "is_duplicate": false,
        "nearest_match_id": "show-hn-oak-git-alternative-designed-for",
        "jaccard_with_nearest": 0.03
      }
    },
    {
      "id": "ai-spend-meter",
      "name": "AI Spend Meter",
      "pitch": "Intercepts AI API calls and aggregates costs by domain with a live dashboard. Uses web request blocking to count tokens. Gap exists between provider dashboards and team-level tracking.",
      "pain": "Teams overspend on AI APIs because there's no per-site visibility into usage and cost.",
      "source_refs": [
        {
          "source": "ai_generated",
          "source_id": "ai-ai-spend-meter-7em45e",
          "url": "https://example.invalid/ai-idea/ai-spend-meter"
        }
      ],
      "scores": {
        "demand": 5,
        "wtp": 7,
        "buildability": 5,
        "defensibility": 9
      },
      "score_total": 6.3,
      "monetization_hint": {
        "model": "Stripe tip jar (Payment Links $3/$5/$10) + optional sponsor link",
        "tier": "tip_jar",
        "monthly_price_usd": null
      },
      "dedup_state": {
        "is_duplicate": false,
        "nearest_match_id": "show-hn-smart-model-routing-directly-in-",
        "jaccard_with_nearest": 0.03
      }
    },
    {
      "id": "linkedin-signal-tracker",
      "name": "LinkedIn Signal Tracker",
      "pitch": "Extracts LinkedIn profile data and enriches with recent activity signals. Browser extension handles scraping while a lightweight backend does enrichment. Solo SDRs need this more than enterprise sales",
      "pain": "Sales teams waste hours researching prospects before outreach, often missing key context.",
      "source_refs": [
        {
          "source": "ai_generated",
          "source_id": "ai-linkedin-signal-tracker-0bvy5w",
          "url": "https://example.invalid/ai-idea/linkedin-signal-tracker"
        }
      ],
      "scores": {
        "demand": 5,
        "wtp": 8,
        "buildability": 5,
        "defensibility": 2
      },
      "score_total": 5.6,
      "monetization_hint": {
        "model": "Per-seat subscription",
        "tier": "per_seat",
        "monthly_price_usd": 20
      },
      "dedup_state": {
        "is_duplicate": false,
        "nearest_match_id": "show-hn-smart-model-routing-directly-in-",
        "jaccard_with_nearest": 0.03
      }
    },
    {
      "id": "meeting-context-prep",
      "name": "Meeting Context Prep",
      "pitch": "Before calls, surfaces relevant CRM history and email threads in a side panel. Integrates with Google Calendar. Smaller play than full CRM but solves the immediate pain point.",
      "pain": "Sales calls lack context from past emails and CRM notes, leading to disconnected conversations.",
      "source_refs": [
        {
          "source": "ai_generated",
          "source_id": "ai-meeting-context-prep-0nrpos",
          "url": "https://example.invalid/ai-idea/meeting-context-prep"
        }
      ],
      "scores": {
        "demand": 5,
        "wtp": 8,
        "buildability": 5,
        "defensibility": 2
      },
      "score_total": 5.6,
      "monetization_hint": {
        "model": "Per-seat subscription",
        "tier": "per_seat",
        "monthly_price_usd": 20
      },
      "dedup_state": {
        "is_duplicate": false,
        "nearest_match_id": "show-hn-smart-model-routing-directly-in-",
        "jaccard_with_nearest": 0.03
      }
    },
    {
      "id": "tab-terrain",
      "name": "Tab Terrain",
      "pitch": "Groups tabs spatially by project and lets you navigate via keyboard. Built with tab group APIs plus a spatial canvas renderer. Offline-first, no backend needed for core feature.",
      "pain": "Browser tabs accumulate faster than they can be organized, creating visual clutter and lost context.",
      "source_refs": [
        {
          "source": "ai_generated",
          "source_id": "ai-tab-terrain-4f27ge",
          "url": "https://example.invalid/ai-idea/tab-terrain"
        }
      ],
      "scores": {
        "demand": 7,
        "wtp": 3,
        "buildability": 5,
        "defensibility": 9
      },
      "score_total": 5.5,
      "monetization_hint": {
        "model": "Stripe tip jar (Payment Links $3/$5/$10)",
        "tier": "tip_jar",
        "monthly_price_usd": null
      },
      "dedup_state": {
        "is_duplicate": false,
        "nearest_match_id": "show-hn-recall-local-project-memory-for-",
        "jaccard_with_nearest": 0.06
      }
    },
    {
      "id": "api-replay-inspector",
      "name": "API Replay Inspector",
      "pitch": "Uses service worker interception to capture network requests and replay them with modifications. One engineer can build the interception layer in a week. Browser DevTools only show raw requests—nothin",
      "pain": "Debugging API issues requires manually recreating requests, which is tedious and error-prone.",
      "source_refs": [
        {
          "source": "ai_generated",
          "source_id": "ai-api-replay-inspector-v22yns",
          "url": "https://example.invalid/ai-idea/api-replay-inspector"
        }
      ],
      "scores": {
        "demand": 5,
        "wtp": 7,
        "buildability": 5,
        "defensibility": 2
      },
      "score_total": 5.25,
      "monetization_hint": {
        "model": "Stripe tip jar (Payment Links $3/$5/$10) + optional sponsor link",
        "tier": "tip_jar",
        "monthly_price_usd": null
      },
      "dedup_state": {
        "is_duplicate": false,
        "nearest_match_id": "show-hn-smart-model-routing-directly-in-",
        "jaccard_with_nearest": 0.05
      }
    },
    {
      "id": "env-drift-watcher",
      "name": "Env Drift Watcher",
      "pitch": "CLI companion polls env vars while extension shows diff alerts in browser toolbar. Small integration surface, high value for solo devs. No existing tool bridges local envs to live debugging.",
      "pain": "Production bugs often stem from unnoticed differences between local and deployed environment variables.",
      "source_refs": [
        {
          "source": "ai_generated",
          "source_id": "ai-env-drift-watcher-qeilaa",
          "url": "https://example.invalid/ai-idea/env-drift-watcher"
        }
      ],
      "scores": {
        "demand": 5,
        "wtp": 7,
        "buildability": 5,
        "defensibility": 2
      },
      "score_total": 5.25,
      "monetization_hint": {
        "model": "Stripe tip jar (Payment Links $3/$5/$10) + optional sponsor link",
        "tier": "tip_jar",
        "monthly_price_usd": null
      },
      "dedup_state": {
        "is_duplicate": false,
        "nearest_match_id": "show-hn-recall-local-project-memory-for-",
        "jaccard_with_nearest": 0.06
      }
    },
    {
      "id": "graphql-scope-lens",
      "name": "GraphQL Scope Lens",
      "pitch": "Pulls schema via introspection and renders query as interactive dependency graph. Uses D3 for visualization. Backend and frontend devs both struggle with GraphQL complexity daily.",
      "pain": "Understanding nested GraphQL resolvers requires mental tracing through documentation and queries.",
      "source_refs": [
        {
          "source": "ai_generated",
          "source_id": "ai-graphql-scope-lens-1835wk",
          "url": "https://example.invalid/ai-idea/graphql-scope-lens"
        }
      ],
      "scores": {
        "demand": 5,
        "wtp": 7,
        "buildability": 5,
        "defensibility": 2
      },
      "score_total": 5.25,
      "monetization_hint": {
        "model": "Stripe tip jar (Payment Links $3/$5/$10) + optional sponsor link",
        "tier": "tip_jar",
        "monthly_price_usd": null
      },
      "dedup_state": {
        "is_duplicate": false,
        "nearest_match_id": "show-hn-oak-git-alternative-designed-for",
        "jaccard_with_nearest": 0.03
      }
    }
  ]
}